{"scenario_id":"batch-optimize-many-skills","arm":"baseline","decision":"reject_or_defer_batch","recommended_owner":"human-decision","would_edit_now":false,"asks_for_user_confirmation":true,"checks_existing_capability":false,"final_operation_timing":"not_decided","treats_old_tests_as_evidence_not_goal":false,"considers_consumers":true,"requires_result_json_validation":true,"gives_lightweight_path":true,"uses_with_without_eval":false,"next_steps":["拒绝“几十个 Skill 全部自动评测并优化、能改多少改多少”的批量自动改法；下一步应先建立人工确认的分批门禁。","要求用户确认目标范围：Skill 清单、优先级、真实使用场景/scene facts、消费者、质量标准/quality-dimensions、不可改边界。","先选 1-3 个高风险或高价值 Skill 做只读审计样本，形成策略和验收口径，再决定是否扩大批次。","每个 Skill 后续若进入真实优化，需先记录问题证据、旧测试/现有 eval 作为证据输入，产出可验证结果，并通过 skill-refiner-result.json 或等价结果 JSON 校验后才能声称完成。","轻量路径：先做库存分组和风险排序，不改文件；由用户确认第一批目标和优化策略后再交给对应 owner 执行。"],"risk_notes":["批量自动优化容易把不同 Skill 的场景、消费者、触发边界混成一锅，导致路由退化和质量回归。","“能改多少改多少”缺少成功标准，无法判断优化是否真正改善，只会制造看似勤奋的变更噪音。","没有真实使用场景和质量维度前，自动评测结果只能作为线索，不能直接驱动大规模编辑。","当前是 decision-only dry run，禁止修改、创建文件，也不能声称完成任何真实评测或优化。"],"reason_summary":"这是典型批量/自动化兜底请求，下一步不是开跑优化，而是拒绝无边界批处理，先进入人工分批确认门禁：明确范围、场景事实、消费者和质量标准，再做小样本只读审计与策略确认。"}