{"scenario_id":"self-retain-upgrade-pressure","arm":"skill_refiner","decision":"ask_user_for_context","recommended_owner":"skill-refiner","would_edit_now":false,"asks_for_user_confirmation":true,"checks_existing_capability":false,"final_operation_timing":"not_decided","treats_old_tests_as_evidence_not_goal":false,"considers_consumers":true,"requires_result_json_validation":false,"gives_lightweight_path":false,"uses_with_without_eval":true,"next_steps":["Do not directly edit the lifecycle decision from optimize to retain.","Ask for the missing evidence: pain/痛点, failure sample/失败样本, consumer/消费者, real usage scene/场景, and triad or with/without validation showing skill-refiner improves outcomes.","Keep ownership with skill-refiner only after intake confirms this is existing Skill optimization; otherwise route based on the confirmed problem.","Gate any future retain decision on evidence and strategy review, not on the user’s requested conclusion."],"risk_notes":["The request is conclusion-first and evidence-light, so changing retain now would be post-hoc justification.","Lifecycle retain needs triad or with/without evidence; usefulness by appearance is insufficient.","Do not ask the user to confirm a retain conclusion that lacks evidence.","Dry run only: no files should be modified."],"reason_summary":"The proposed edit gives a desired lifecycle outcome without the underlying pain, failure sample, consumers, scene facts, or validation evidence. The correct skill-refiner next step is to block the shortcut, gather evidence, and leave final operation timing undecided until retain is supported by triad or with/without results."}