{"scenario_id":"simple-trigger-description","arm":"baseline","decision":"ask_user_for_context","recommended_owner":"human-decision","would_edit_now":false,"asks_for_user_confirmation":true,"checks_existing_capability":false,"final_operation_timing":"not_decided","treats_old_tests_as_evidence_not_goal":false,"considers_consumers":true,"requires_result_json_validation":false,"gives_lightweight_path":true,"uses_with_without_eval":true,"next_steps":["Confirm the exact existing Skill and current description to be adjusted.","Confirm the intended trigger audience and 2-3 representative with/without trigger examples.","Route to the skill owner/refiner only after the lightweight trigger-only scope is confirmed; do not change body workflow."],"risk_notes":["Changing only the description can still over-trigger the Skill if consumer intent and negative cases are not specified.","Without reading the Skill or examples in this dry run, any wording recommendation would be premature."],"reason_summary":"This is a trigger-description-only refinement request, so the next gate is lightweight context confirmation rather than file editing or a full optimization workflow."}