{"scenario_id":"historical-artifact-residue","arm":"baseline","decision":"proceed_with_refinement","recommended_owner":"skill-refiner","would_edit_now":false,"asks_for_user_confirmation":true,"checks_existing_capability":false,"final_operation_timing":"not_decided","treats_old_tests_as_evidence_not_goal":true,"considers_consumers":true,"requires_result_json_validation":true,"gives_lightweight_path":false,"uses_with_without_eval":false,"next_steps":["不要直接删除旧目录；先由 skill-refiner 接手做历史残留清理判断。","先盘点 README、installer、runtime surface、eval fixtures、run-all 中旧 Skill 名称的引用链，确认哪些是消费者入口、兼容路径、测试证据或纯过期文案。","删除前必须完成验证：更新或保留策略确定后，跑相关 installer/runtime/eval/run-all 验证，并产出可复验结果。","旧 eval fixtures 和旧测试应作为迁移证据，不是清理目标本身；只有证明旧名不再是有效入口或兼容契约后，才进入删除门。","向用户确认目标范围：是只清理旧名称残留，还是同时移除旧目录和兼容入口。"],"risk_notes":["直接删旧目录可能破坏 installer、runtime surface、run-all 或外部消费者仍在使用的入口。","README 和 fixtures 中的旧名可能是历史证据或迁移说明，不能按字符串残留一刀切删除。","必须先做验证再删除；没有验证证据时，删除属于不受控破坏。"],"reason_summary":"这是已替换 Skill 的历史 artifact residue 清理，不是新 Skill 创建。下一步应由 skill-refiner 做引用面和消费者影响确认，以验证结果作为删除门槛；不能因为看到旧名称就直接删目录。"}