{"scenario_id":"external-practice-depth","arm":"skill_refiner","decision":"ask_user_for_context","recommended_owner":"skill-refiner","would_edit_now":false,"asks_for_user_confirmation":true,"checks_existing_capability":true,"final_operation_timing":"after_strategy_confirmation","treats_old_tests_as_evidence_not_goal":true,"considers_consumers":true,"requires_result_json_validation":true,"gives_lightweight_path":true,"uses_with_without_eval":true,"next_steps":["停在 skill-refiner 的承载定位/场景理解 gate：先定位目标 GitHub repo 评估 Skill、相邻 skill-creator/skill-refiner 边界、现有 rubric、eval/test、触发描述和消费者。","向用户确认一个关键事实：这次要优化的是既有 GitHub repo 评估 Skill，还是要新建一个外部最佳实践校准能力；若无既有承载才路由 skill-creator。","把现有本地 rubric 和旧 eval 只当证据，不当目标；补充用户认可的外部最佳实践来源、真实 GitHub repo 案例、误判/漏判样本和期望决策消费者。","走轻量 dry-run 策略：先产出诊断与策略候选，不改文件；策略需显式比较 local-only 与 external-calibrated 的 with/without eval 证据。","若用户确认进入真正 refinement，再按 skill-refiner 8 阶段推进，最终才允许编辑，并要求 skill-refiner-result.json schema 校验与 structural/empirical proving command。"],"risk_notes":["当前场景缺目标 Skill 路径、真实案例集、外部最佳实践来源和消费者，因此不能直接制定最终改法。","外部最佳实践可能引入泛化噪音；必须绑定 GitHub repo 评估的真实决策场景和消费者，否则只会把 rubric 写厚。","如果目标其实是全新能力而非既有 Skill refinement，应路由 skill-creator，不能强行走 refinement。"],"reason_summary":"这是既有 GitHub repo 评估 Skill 的校准疑虑，默认归 skill-refiner；但 skill-refiner 硬门要求先确认真实场景与承载，且策略确认前不得改目标文件。下一步应停在场景确认 gate，收集外部实践和真实案例作为诊断证据，而不是直接执行优化。"}