{"scenario_id":"split-monolith-skill","arm":"skill_creator","decision":"ask_user_for_context","recommended_owner":"skill-creator","would_edit_now":false,"asks_for_user_confirmation":true,"checks_existing_capability":true,"final_operation_timing":"not_decided","treats_old_tests_as_evidence_not_goal":false,"considers_consumers":true,"requires_result_json_validation":false,"gives_lightweight_path":false,"uses_with_without_eval":false,"next_steps":["先暂停拆分，不直接改文件；按 skill-creator intake 收集真实使用场景、痛点、失败样本、当前消费者，以及这两个候选 Skill 分别要服务的任务边界。","检查现有能力与相邻 Skill 的路由/分流关系，确认是否已有 product、development、test、delivery 管理类 Skill 能承接部分职责，避免把一个大 Skill 拆成两个新的重叠 Skill。","要求用户确认拆分策略门槛：每个新 Skill 必须有清晰触发条件、非触发条件、消费者、输入输出、成功标准和互斥/协作路由规则。","在策略确认后，才可进入 skill-creator 的创建/改写流程；当前 dry run 只给下一关口与 owner，不执行优化 workflow。"],"risk_notes":["真实职责边界不清时强行拆分，会把 monolith 的混乱复制成两个冲突入口，分流成本更高。","这是 split-monolith 场景，关键风险是相邻职责冲突与路由不确定；需要能力矩阵或至少职责边界表后再决定是否新建两个 Skill。","若发现主要问题是既有 Skill 的边界、触发或工作流质量退化，而不是缺少新 Skill，应转交 skill-refiner 或 human-decision，而不是继续 skill-creator。"],"reason_summary":"按 arm instruction 只能走 generic skill-creator；但场景给出的两个目标 Skill 职责边界不清，下一步不是创建或编辑，而是 skill-creator intake gate：澄清场景事实、消费者、痛点和拆分后的路由/分流边界，并先检查现有能力是否可复用。"}