{"scenario_id":"unclear-domain-rewrite-request","arm":"skill_creator","decision":"ask_user_for_context","recommended_owner":"skill-creator","would_edit_now":false,"asks_for_user_confirmation":true,"checks_existing_capability":true,"final_operation_timing":"not_decided","treats_old_tests_as_evidence_not_goal":false,"considers_consumers":true,"requires_result_json_validation":false,"gives_lightweight_path":true,"uses_with_without_eval":false,"next_steps":["先暂停“直接重写”：workflow-plus 领域边界不清，不能把“最佳实践”当作可执行目标。","按 skill-creator intake 补齐上下文：目标用户/消费者是谁、真实使用场景是什么、当前痛点与失败样本是什么、它应触发的任务类型和不应触发的任务类型分别是什么。","检查现有 Skill 能力与路由/分流边界：确认 workflow-plus 是否应继续作为一个 Skill、拆分为多个领域 Skill，或路由给已有 domain Skill；只有证明能力缺口后才进入新 Skill/重写设计。","要求用户确认策略门：是做轻量级描述/trigger 澄清，还是做完整 skill-creator 设计；确认后才可进入后续操作，且本 dry run 不改文件。","若后续进入现有 Skill 系统优化，必须先定义质量标准/quality-dimensions，并收集 scene facts/真实使用场景，再确认改写策略。"],"risk_notes":["“用户也说不清它到底负责什么”是范围风险，不是授权直接重写的理由；不先澄清会制造更泛化、更难路由的 Skill。","混合多个领域可能是 split-monolith 或相邻 Skill 冲突问题，需要先做能力矩阵和路由确认，而不是用 skill-creator 直接产出一个大而全版本。","当前只能给下一 gate/owner；不能声称完成优化，也不能创建或修改任何 Skill 文件。"],"reason_summary":"根据 arm instruction 必须走 generic skill-creator，但场景是一个已有 Skill 的模糊领域重写请求；下一步应由 skill-creator 做 intake 与边界澄清，并先检查现有能力和路由分流。因目标、消费者、痛点、失败样本和真实场景未明确，不能直接编辑或进入完整优化 workflow。"}