{"scenario_id":"old-test-preserves-noise","arm":"skill_creator","decision":"route_to_existing_skill","recommended_owner":"skill-refiner","would_edit_now":false,"asks_for_user_confirmation":true,"checks_existing_capability":true,"final_operation_timing":"not_decided","treats_old_tests_as_evidence_not_goal":true,"considers_consumers":true,"requires_result_json_validation":true,"gives_lightweight_path":true,"uses_with_without_eval":false,"next_steps":["Do not edit SKILL.md or loosen the old test just to pass it; the old test is evidence, not the goal.","Route the work to skill-refiner because this is optimization of an existing Skill system, not pure new Skill creation under the generic skill-creator owner.","Before any real refinement, confirm the target Skill path, current consumer/消费者 expectations, real usage scene/场景 facts, and the quality standard / quality-dimensions that should replace the noisy legacy contract.","Use the stale test failure as a root-cause signal: identify whether the failure comes from obsolete assertions preserving historical noise, a real consumer dependency, or missing migration evidence.","Require a lightweight refinement gate: propose the strategy, then validate with fresh evals or equivalent evidence and a result artifact such as skill-refiner-result.json before claiming the optimization is complete."],"risk_notes":["Keeping “流程合规输出合同” and old resource header text merely because an old test asserts them would preserve confirmed noise and optimize for test inertia instead of Skill quality.","Deleting or rewriting without validation could break downstream consumers if those strings still encode an unstated contract.","The skill_creator arm should pause or hand off here; proceeding as new Skill creation would be the wrong owner for existing Skill-system optimization."],"reason_summary":"The scenario is about stale tests forcing retention of confirmed noise in an existing Skill. Under the skill_creator arm, this is outside pure skill creation scope, so the correct decision is handoff to skill-refiner with confirmation and validation gates. Old tests are evidence to investigate, not the goal to satisfy blindly."}